Year,Questions,Marks,Topic,Subtopic,Mark Scheme,Mark scheme K,Mark scheme Ap,Mark scheme An,Page,Check,
May 2017, evaluate these two options and recommend which option would help maria allen meet her sales target,20,meeting customer needs,product service design mix function aesthetics cost in elements reflect social trend resource depletion waste minimisation reuse recycle ethical sourcing branding promotion types benefits strong added value ability charge premium price elasticity demand build brand unique selling point usp differentiation advertising sponsorship media viral marketing emotional pricing strategy plus mark up skimming penetration predatory competitive psychological factor determine appropriate particular situation number competition business environment strength stage life cycle cost profit online sale comparison site distribution channel extension boston matrix portfolio consumer behaviour customer loyalty,3 Knowledge 4 Application 4 Analysis 6 Evaluation 6 Ethical Sourcing Her USP is sustainable gifts and products made from ethically sourced materials She has achieved success so far with exclusive partnerships with British Museum Tate Galleries and Royal Academy of Arts which is likely to be because she handcrafts unique products from reclaimed wood  Costs may not be important as she can charge high prices in a niche market The tailored love letters are made to order so will use job production which will increase costs but add value making people more willing to buym She operates in a niche market so quality of materials is likely to be more important focusing on costs could reduce quality The MadeinBritain slogan is also important to Maria Allen brand focusing on costs may mean offshoring to less ethical production facilities Cost Minimisation Ethically sourced materials may cost more which may impact on prices and reduce sales Keeping costs down would enable Maria to keep prices competitive in competitive market and gain more sales  Cost minimisation would enable Maria to invest in development of new product ranges to increase sales Maria will need to produce more to meet her turnover target of £500000 economies of scale could be gained with increased production Potential Recommendation  Using ethically sourced materials is her unique selling point and is important to her existing customers without it she might not be able to compete in market and lose sales Maria Allen should focus on costs because she wants to expand and increase her turnover by focusing on costs this may allow her to reduce prices andrefore boost sales  (20),,,,15,TRUE,13
May 2019_v2,Define the term 'qualitative research',2,meeting customer needs,,,,,,2,TRUE,11
May 2019_v2,"Calculate the price elasticity of demand PED for a Superdry t-shirt if the price decreases by 10% and sales increase from 120,000 to  150,000 You are advised to show your working",4,market,,,,,,2,TRUE,11
May 2019_v2,Analyse how two different methods of primary research could help Superdry,6,meeting customer needs,,,,,,3,TRUE,11
May 2019_v2,"Using the data in Extract B, discuss the likely impact of Superdrya's profit share plan on employee motivation",8,managing people,,,,,,4,TRUE,11
May 2019_v2,Assess the extent to which the Boston Matrix may help Superdry compete in the clothing market,10,marketing mix and strategy,,,,,,5,TRUE,11
May 2019_v2,Define the term ‚online retailing,2,marketing mix and strategy,,,,,,7,TRUE,11
May 2019_v2,"Using the data from Extract D, explain one way changes in fashions, tastes or preferences have affected demand for Ocado",4,market,,,,,,7,TRUE,11
May 2019_v2,Analyse two advantages for Ocado of having cost efficiency as a main business objective,6,entreprenuers and leaders,,,,,,8,TRUE,11
May 2019_v2,Discuss the extent to which Ocado has been successful in adding value to its business,8,meeting customer needs,,,,,,9,TRUE,11
May 2019_v2,Assess the importance of place in Ocado's marketing mix,10,marketing mix and strategy,,,,,,10,TRUE,11
May 2019,What is meant by social enterprise?,2,Unit2,,,,,,3,,
May 2019_v2,"Function, aesthetics and cost of manufacture are elements of the design mix. Evaluate which of these is the most important element for manufacturers of
smartphones.",20,marketing mix and strategy,,,,,,12,TRUE,11
May 2019,What is meant by business objective?,2,entreprenuers and leaders,,,,,,3,TRUE,12
May 2019,Explain how The Good Hotel's social objectives could lead to an increase in added value,4,entreprenuers and leaders,,,,,,4,TRUE,12
May 2019,Explain how The Good Hotel in Guatemala could benefit from operating in a niche market,4,meeting customer needs,,,,,,5,TRUE,12
May 2019,Assess two methods The Good Hotel could use to develop customer loyalty,8,marketing mix and strategy,,,,,,6,TRUE,12
May 2019,"Assess whether a unique selling point USP is the most important factor in determining a pricing strategy for a premium priced hotel, such as The Good Hotel",10,marketing mix and strategy,,,,,,8,TRUE,12
May 2019,What is meant by span of control?,2,managing people,,,,,,11,TRUE,12
May 2019,What is meant by consultation?,2,managing people,,,,,,11,TRUE,12
May 2019,"Calculate, to 2 decimal places, the percentage fall in the price of an Omega Seamaster watch",4,market,,,,,,12,TRUE,12
May 2019,Explain how Beaverbrooks could use the Boston matrix,4,marketing mix and strategy,,,,,,13,TRUE,12
May 2019,Assess two factors that could affect the supply of Beaverbrooks silver jewellery,8,market,,,,,,14,TRUE,12
May 2019,Assess the potential benefits for Beaverbrooks of having a more decentralised organisational structure,10,managing people,,,,,,16,TRUE,12
Jan 2019,Define the term ‘product portfolio’,2,marketing mix and strategy,,,,,,2,TRUE,10
Jan 2019,"Using the data, calculate the income elasticity of demand YED for Primark in You are advised to show your working",4,market,,,,,,2,TRUE,10
Jan 2019,Analyse two possible difficulties Primark might face from selling to a mass market,6,meeting customer needs,,,,,,3,TRUE,10
Jan 2019,Discuss the benefits to Primark of using a cost plus pricing system,8,marketing mix and strategy,,,,,,4,TRUE,10
Jan 2019,Assess the importance to Primark of having ethical sourcing as a business objective,10,entreprenuers and leaders,,,,,,5,TRUE,10
Jan 2019,Define the term ‘entrepreneur’,2,entreprenuers and leaders,,,,,,7,TRUE,10
Jan 2019,Construct a supply and demand diagram to show the impact on the market for smoothie drinks following damage to fruit crops caused by poor weather,4,market,,,,,,7,TRUE,10
Jan 2019,Analyse two factors that are likely to affect the demand for Innocent products,6,market,,,,,,8,TRUE,10
Jan 2019,Discuss the benefits of market segmentation to a business such as Innocent,8,meeting customer needs,,,,,,9,TRUE,10
Jan 2019,Assess the advantages for Innocent of test marketing its products,10,meeting customer needs,,,,,,10,TRUE,10
May 2020,Define the term ‚market share,2,meeting customer needs,,,,,,2,TRUE,11
May 2020,Calculate the price elasticity of demand PED for the television You are advised to show your working,4,market,,,,,,2,TRUE,11
May 2020,Analyse two methods that Samsung might have used to build its brand,6,marketing mix and strategy,,,,,,3,TRUE,11
May 2020,"Discuss the benefits, for a business such as Samsung, of using secondary research when developing new products",8,meeting customer needs,,,,,,4,TRUE,11
May 2020,"Assess the advantages for a business, such as Samsung, of using a price skimming strategy for its new products",10,marketing mix and strategy,,,,,,5,TRUE,11
May 2020,Define the term ‚product differentiationa,2,meeting customer needs,,,,,,7,TRUE,11
May 2020,Construct a supply and demand diagram to show the impact of increased advertising by Lehman's on the handmade tools market,4,market,,,,,,7,TRUE,11
May 2020,Analyse two advantages for Lehman's of providing benefits to its employees,6,managing people,,,,,,8,TRUE,11
May 2020,Discuss the importance of function to Lehman's when considering the design mix for new products,8,marketing mix and strategy,,,,,,9,TRUE,11
May 2020,Assess the benefits of operating in a niche market for a business such as Lehman's,10,meeting customer needs,,,,,,10,TRUE,11
May 2020,Evaluate which type of training may be the most effective for Shangri-La Hotels.,20,managing people,,,,,,12,TRUE,11
Jan 2020,Define the term 'uncertainty',2,entreprenuers and leaders,,,,,,2,TRUE,9
Jan 2020,Analyse two entrepreneurial characteristics that Rossi Mitova has that may have contributed to her success,6,entreprenuers and leaders,,,,,,3,TRUE,9
Jan 2020,"Discuss the advantages for small businesses, such as the farms in Bulgaria, of using an online retailing service to sell their products",8,marketing mix and strategy,,,,,,4,TRUE,9
Jan 2020,Assess if there is a trade-off between social objectives and profit for these farmers,10,entreprenuers and leaders,,,,,,8,TRUE,9
Jan 2020,Define the term ‚secondary market researcha,2,meeting customer needs,,,,,,7,TRUE,9
Jan 2020,"Using Extract C, calculate to 2 decimal places, the percentage change in sales revenue for Skechers between and You are advised to show your working",4,meeting customer needs,,,,,,7,TRUE,9
Jan 2020,Analyse two advantages of using focus groups for a business such as Skechers,6,meeting customer needs,,,,,,8,TRUE,9
Jan 2020,Discuss how the product life cycle may help Skechers develop its product portfolio,8,marketing mix and strategy,,,,,,9,TRUE,9
Jan 2020,Assess the extent to which a centralised organisational structure may benefit Skechers,10,managing people,,,,,,10,TRUE,9
Oct 2021,Define the term ‘niche market’.,2,meeting customer needs,,,,,,2,TRUE,22
Oct 2021,"Construct a supply and demand diagram to show the impact of a decrease in the
price of milk and cream on the ice cream market.",4,market,,,,,,2,TRUE,22
Oct 2021,"Analyse two factors that might influence the price elasticity of demand (PED) for
ice cream.",6,market,,,,,,3,TRUE,22
Oct 2021,Discuss the importance of product differentiation to the success of Oppo.,8,meeting customer needs,,,,,,4,TRUE,22
Oct 2021,"Assess the advantages to Oppo of using these methods when developing
its brand.",10,marketing mix and strategy,,,,,,5,TRUE,22
Oct 2021,Define the term ‘social media’.,2,marketing mix and strategy,,,,,,7,TRUE,22
Oct 2021,"Using the above data, calculate the total amount of redundancy payments made
by Deutsche Bank. You are advised to show your workings.",4,managing people,,,,,,8,TRUE,22
Oct 2021,"Analyse two possible benefits for Deutsche Bank of using collective bargaining to
negotiate redundancy payments with its employees.",6,managing people,,,,,,9,TRUE,22
Oct 2021,"Discuss the advantages for Deutsche Bank of using television advertising in its
marketing campaign.",8,marketing mix and strategy,,,,,,10,TRUE,22
Oct 2021,"Assess the impact on Deutsche Bank of the changes made to its
organisational structure.",10,managing people,,,,,,11,TRUE,22
Oct 2021,"Evaluate the extent to which the recruitment and training methods used by Japanese
businesses may help them compete in the global artificial intelligence (AI) industry.",20,managing people,,,,,,13,TRUE,22
Jan 2022,Define the term ‘quantitative data’.,2,meeting customer needs,,,,,,2,TRUE,22
Jan 2022,"Construct a supply and demand diagram to show the impact of increasing
publicity on the biodegradable packaging market.",4,market,,,,,,2,TRUE,22
Jan 2022,"Analyse two entrepreneurial characteristics shown by Vaibhav Anant that may
have helped Bambrew to succeed.",6,managing people,,,,,,3,TRUE,22
Jan 2022,"Discuss the benefits for Vaibhav Anant of using secondary market research when
starting his business.",8,meeting customer needs,,,,,,4,TRUE,22
Jan 2022,"Assess if there is likely to be a trade-off between an ethical stance and profit for
Bambrew.",10,entreprenuers and leaders,,,,,,5,TRUE,22
Jan 2022,Define the term ‘social trends’.,2,entreprenuers and leaders,,,,,,7,TRUE,22
Jan 2022,"Using the data, calculate the increase in monthly revenue for Aldi between
January 2019 and January 2020. You are advised to show your workings.",4,meeting customer needs,,,,,,8,TRUE,22
Jan 2022,"Analyse two benefits for Aldi of having employee welfare as one of its main
business objectives.",6,entreprenuers and leaders,,,,,,9,TRUE,22
Jan 2022,Assess the benefits for Aldi of sponsoring the UK Olympic team.,8,marketing mix and strategy,,,,,,10,TRUE,22
Jan 2022,Assess the likely impact of price comparison websites on supermarkets in the UK.,10,marketing mix and strategy,,,,,,11,TRUE,22
Jan 2022,"Evaluate the extent to which Nike’s distribution strategy is likely to contribute to its
future success.",20,marketing mix and strategy,,,,,,13,TRUE,22
June 2021,Define the term ‘demand’.,2,market,,,,,,2,TRUE,20
June 2021,"Using this data and Extract B, calculate, to two decimal places, the total percentage market share of the top three chocolate manufacturers. You are advised to show your working.",4,meeting customer needs,,,,,,2,TRUE,20
June 2021,"Analyse two factors that are likely to determine the pricing strategy used by
chocolate manufacturers.",6,marketing mix and strategy,,,,,,3,TRUE,20
June 2021,Discuss the benefits to a business such as Ferrero of motivating its employees.,8,managing people,,,,,,4,TRUE,20
June 2021,Assess the advantages of market segmentation to a business in the chocolate market.,10,meeting customer needs,,,,,,5,TRUE,20
June 2021,Define the term ‘customer loyalty’.,2,marketing mix and strategy,,,,,,7,TRUE,20
June 2021,Analyse two factors that may lead to a change in the supply of delivery services in Turkey.,6,market,,,,,,8,TRUE,20
June 2021,"Discuss the benefits, for a business such as Kapgel, of using part-time and
temporary employees.",8,managing people,,,,,,9,TRUE,20
June 2021,"Assess the extent to which product is the most important element of the
marketing mix for on-demand delivery businesses in Turkey.",10,marketing mix and strategy,,,,,,10,TRUE,20
June 2021,"Evaluate whether TOMS should focus on cost efficiency or social objectives to survive
in the markets in which it operates.",20,entreprenuers and leaders,,,,,,12,TRUE,20
Nov 2021,"Using the data in Extract A, calculate the change in value of sugar-free sweets
sales predicted between 2018 and 2023. State your answer to 2 decimal places.
You are advised to show your working.",4,meeting customer needs,,,,,,4,TRUE,20
Nov 2021,"Explain one way in which a business such as Bon Bon’s adds value to the products
it sells.",4,marketing mix and strategy,,,,,,5,TRUE,20
Nov 2021,Assess a likely trade-off for Bon Bon’s of not having ‘mass market ambition.’,10,meeting customer needs,,,,,,6,TRUE,20
Nov 2021,Assess the possible consequences for Bon Bon’s continuing to sell ‘Traffic Light Lollies’.,12,meeting customer needs,,,,,,8,TRUE,20
Nov 2021,"Evaluate these two options and recommend which one is more likely to improve
Bon Bon’s profitability.",20,meeting customer needs,,,,,,10,TRUE,20
Nov 2021,"Using the data in Extract D, calculate the percentage growth in the total
McDonald’s restaurants operating in Brazil, between 2012 and 2018. State your
answer to 2 decimal places.
You are advised to show your working.",4,meeting customer needs,,,,,,15,TRUE,20
Nov 2021,"Explain how one of Ansoff’s generic strategies might be applied to Taco Bell’s
decision to enter the Brazilian market.",4,marketing mix and strategy,,,,,,16,TRUE,20
Nov 2021,"Using the data from Extract F, assess the impact of the exchange rate movements
between January 2019 and April 2019 on the total costs of a business, such as
Tropicana, which imports to the USA from Brazil.",10,Unit2,,,,,,17,,
Nov 2021,"Assess whether legal controls are the most effective way of controlling the actions
of multinational companies in countries, such as Brazil.",12,Unit2,,,,,,19,,
Nov 2021,"Evaluate these two options and recommend which one is most suitable for
Taco Bell to increase its sales in Brazil.",20,meeting customer needs,,,,,,21,TRUE,20
Oct 2019,Define the term ‘distribution channels’.,2,marketing mix and strategy,,,,,,2,TRUE,22
Oct 2019,"Calculate the percentage change in quantity demanded of Coca-Cola.
You are advised to show your working.",4,market,,,,,,2,TRUE,22
Oct 2019,Analyse two benefits of strong branding for Coca-Cola.,6,marketing mix and strategy,,,,,,3,TRUE,22
Oct 2019,"Discuss the benefits for Coca-Cola of providing its workers with financial
incentives.",8,managing people,,,,,,4,TRUE,22
Oct 2019,"Assess the advantages for a company, such as Coca-Cola, of using face-to-face
surveys when collecting market data.",10,meeting customer needs,,,,,,5,TRUE,22
Oct 2019,Define the term ‘competitive pricing’.,2,marketing mix and strategy,,,,,,7,TRUE,22
Oct 2019,"Explain one reason why product may be considered the most important element
of the marketing mix for Emirates.",4,marketing mix and strategy,,,,,,7,TRUE,22
Oct 2019,"Analyse two benefits for a company, such as Emirates, of using social media.",6,marketing mix and strategy,,,,,,8,TRUE,22
Oct 2019,Discuss how competition in the airline market may affect customers.,8,market,,,,,,9,TRUE,22
Oct 2019,"Assess the extent to which market mapping may have been useful to Emirates in
growing its business.",10,meeting customer needs,,,,,,10,TRUE,22
Oct 2019,"Evaluate whether the change in the organisational structure at Tata Motors is likely to
lead to an increase in its efficiency.",20,managing people,,,,,,12,TRUE,22
May 2020_v2,What is meant by business to business (B2B) marketing?,2,marketing mix and strategy,,,,,,3,TRUE,26
May 2020_v2,What is meant by sole trader?,2,Unit2,,,,,,3,,
May 2020_v2,Explain how market orientation could benefit Hydra Creative.,4,meeting customer needs,,,,,,4,TRUE,26
May 2020_v2,Explain one reason why Hydra Creative might use an extension strategy.,4,marketing mix and strategy,,,,,,5,TRUE,26
May 2020_v2,"Assess two difficulties Ryan may face as he develops from an entrepreneur
to a leader.",8,entreprenuers and leaders,,,,,,6,TRUE,26
May 2020_v2,Assess the likely benefits to Hydra Creative of becoming a private limited company.,10,Unit2,,,,,,8,,
May 2020_v2,State two examples of entrepreneurial motives.,2,entreprenuers and leaders,,,,,,11,TRUE,26
May 2020_v2,What is meant by sponsorship?,2,marketing mix and strategy,,,,,,11,TRUE,26
May 2020_v2,"Explain how opportunity cost might have applied to Zack when he chose to set up
Ape Snacks.",4,entreprenuers and leaders,,,,,,12,TRUE,26
May 2020_v2,"Using the data from Extract B, construct a supply and demand diagram to
illustrate the impact of ageing coconut trees on the existing coconut market.",4,market,,,,,,13,TRUE,26
May 2020_v2,Assess two factors that could cause a change in demand for Ape Snacks.,8,market,,,,,,14,TRUE,26
May 2020_v2,"Assess whether social trends might affect the design mix for Ape Snacks’
coconut snacks.",10,marketing mix and strategy,,,,,,16,TRUE,26
May 2020_v2,"Evaluate these two options and recommend which option is most likely to prevent
further business failure.",20,Unit2,,,,,,19,,
Oct 2021,Define the term ‘niche market’.,2,meeting customer needs,meeting customer needs,,,,,2,FALSE,22
Oct 2021,"Construct a supply and demand diagram to show the impact of a decrease in the
price of milk and cream on the ice cream market.",4,market,market,,,,,2,FALSE,22
Oct 2021,"Analyse two factors that might influence the price elasticity of demand (PED) for
ice cream.",6,market,market,,,,,3,FALSE,22
Oct 2021,Discuss the importance of product differentiation to the success of Oppo.,8,meeting customer needs,meeting customer needs,,,,,4,FALSE,22
Oct 2021,"Assess the advantages to Oppo of using these methods when developing
its brand.",10,marketing mix and strategy,marketing mix and strategy,,,,,5,FALSE,22
Oct 2021,Define the term ‘social media’.,2,marketing mix and strategy,marketing mix and strategy,,,,,7,FALSE,22
Oct 2021,"Using the above data, calculate the total amount of redundancy payments made
by Deutsche Bank. You are advised to show your workings.",4,managing people,managing people,,,,,8,FALSE,22
Oct 2021,"Analyse two possible benefits for Deutsche Bank of using collective bargaining to
negotiate redundancy payments with its employees.",6,managing people,managing people,,,,,9,FALSE,22
Oct 2021,"Discuss the advantages for Deutsche Bank of using television advertising in its
marketing campaign.",8,marketing mix and strategy,marketing mix and strategy,,,,,10,FALSE,22
Oct 2021,"Assess the impact on Deutsche Bank of the changes made to its
organisational structure.",10,managing people,managing people,,,,,11,FALSE,22
Oct 2021,"Evaluate the extent to which the recruitment and training methods used by Japanese
businesses may help them compete in the global artificial intelligence (AI) industry.",20,managing people,managing people,,,,,13,FALSE,22
Jan 2022,Define the term ‘quantitative data’.,2,meeting customer needs,meeting customer needs,,,,,2,FALSE,22
Jan 2022,"Construct a supply and demand diagram to show the impact of increasing
publicity on the biodegradable packaging market.",4,market,market,,,,,2,FALSE,22
Jan 2022,"Analyse two entrepreneurial characteristics shown by Vaibhav Anant that may
have helped Bambrew to succeed.",6,entreprenuers and leaders,entreprenuers and leaders,,,,,3,FALSE,22
Jan 2022,"Discuss the benefits for Vaibhav Anant of using secondary market research when
starting his business.",8,meeting customer needs,meeting customer needs,,,,,4,FALSE,22
Jan 2022,"Assess if there is likely to be a trade-off between an ethical stance and profit for
Bambrew.",10,entreprenuers and leaders,entreprenuers and leaders,,,,,5,FALSE,22
Jan 2022,Define the term ‘social trends’.,2,meeting customer needs,meeting customer needs,,,,,7,FALSE,22
Jan 2022,"Using the data, calculate the increase in monthly revenue for Aldi between
January 2019 and January 2020. You are advised to show your workings.",4,meeting customer needs,meeting customer needs,,,,,8,FALSE,22
Jan 2022,"Analyse two benefits for Aldi of having employee welfare as one of its main
business objectives.",6,entreprenuers and leaders,entreprenuers and leaders,,,,,9,FALSE,22
Jan 2022,Assess the benefits for Aldi of sponsoring the UK Olympic team.,8,marketing mix and strategy,marketing mix and strategy,,,,,10,FALSE,22
Jan 2022,Assess the likely impact of price comparison websites on supermarkets in the UK.,10,meeting customer needs,meeting customer needs,,,,,11,FALSE,22
Jan 2022,"Evaluate the extent to which Nike’s distribution strategy is likely to contribute to its
future success.",20,marketing mix and strategy,marketing mix and strategy,,,,,13,FALSE,22
June 2021,Define the term ‘demand’.,2,market,market,,,,,2,FALSE,20
June 2021,"Using this data and Extract B, calculate, to two decimal places, the total
percentage market share of the top three chocolate manufacturers. You are
advised to show your working.",4,meeting customer needs,meeting customer needs,,,,,2,FALSE,20
June 2021,"Analyse two factors that are likely to determine the pricing strategy used by
chocolate manufacturers.",6,marketing mix and strategy,marketing mix and strategy,,,,,3,FALSE,20
June 2021,Discuss the benefits to a business such as Ferrero of motivating its employees.,8,managing people,managing people,,,,,4,FALSE,20
June 2021,Assess the advantages of market segmentation to a business in the chocolate market.,10,marketing mix and strategy,marketing mix and strategy,,,,,5,FALSE,20
June 2021,Define the term ‘customer loyalty’.,2,marketing mix and strategy,marketing mix and strategy,,,,,7,FALSE,20
June 2021,Analyse two factors that may lead to a change in the supply of delivery services in Turkey.,6,market,market,,,,,8,FALSE,20
June 2021,"Discuss the benefits, for a business such as Kapgel, of using part-time and
temporary employees.",8,managing people,managing people,,,,,9,FALSE,20
June 2021,"Assess the extent to which product is the most important element of the
marketing mix for on-demand delivery businesses in Turkey.",10,marketing mix and strategy,marketing mix and strategy,,,,,10,FALSE,20
June 2021,"Evaluate whether TOMS should focus on cost efficiency or social objectives to survive
in the markets in which it operates.",20,entreprenuers and leaders,entreprenuers and leaders,,,,,12,FALSE,20
Nov 2021,"Using the data in Extract A, calculate the change in value of sugar-free sweets
sales predicted between 2018 and 2023. State your answer to 2 decimal places.
You are advised to show your working.",4,meeting customer needs,meeting customer needs,,,,,4,FALSE,20
Nov 2021,"Explain one way in which a business such as Bon Bon’s adds value to the products
it sells.",4,meeting customer needs,meeting customer needs,,,,,5,FALSE,20
Nov 2021,Assess a likely trade-off for Bon Bon’s of not having ‘mass market ambition.’,10,meeting customer needs,meeting customer needs,,,,,6,FALSE,20
Nov 2021,Assess the possible consequences for Bon Bon’s continuing to sell ‘Traffic Light Lollies’.,12,Unit2,Unit2,,,,,8,FALSE,
Nov 2021,"Evaluate these two options and recommend which one is more likely to improve
Bon Bon’s profitability.",20,marketing mix and strategy,marketing mix and strategy,,,,,10,FALSE,20
Nov 2021,"Using the data in Extract D, calculate the percentage growth in the total
McDonald’s restaurants operating in Brazil, between 2012 and 2018. State your
answer to 2 decimal places.
You are advised to show your working.",4,meeting customer needs,meeting customer needs,,,,,15,FALSE,20
Nov 2021,"Explain how one of Ansoff’s generic strategies might be applied to Taco Bell’s
decision to enter the Brazilian market.",4,marketing mix and strategy,marketing mix and strategy,,,,,16,FALSE,20
